{
  "$schema": "https://json-schema.org/draft/2020-12/schema",
  "title": "PCGEProvenanceSource",
  "description": "Schema for PCGE source and provenance metadata",
  "type": "object",
  "properties": {
    "title": {
      "type": "string",
      "minLength": 1,
      "pattern": "\\S"
    },
    "authority": {
      "type": "string",
      "minLength": 1,
      "pattern": "\\S"
    },
    "resolution": {
      "type": "string",
      "minLength": 1,
      "pattern": "\\S"
    },
    "resolution_date": {
      "type": "string",
      "pattern": "^[0-9]{4}-[0-9]{2}-[0-9]{2}(?![\\s\\S])",
      "format": "date"
    },
    "publication_date": {
      "type": "string",
      "pattern": "^[0-9]{4}-[0-9]{2}-[0-9]{2}(?![\\s\\S])",
      "format": "date"
    },
    "mandatory_effective_date": {
      "type": "string",
      "pattern": "^[0-9]{4}-[0-9]{2}-[0-9]{2}(?![\\s\\S])",
      "format": "date"
    },
    "resolution_url": {
      "type": "string",
      "minLength": 1,
      "pattern": "\\S"
    },
    "source_filename": {
      "type": "string",
      "minLength": 1,
      "pattern": "\\S"
    },
    "source_sha256": {
      "type": "string",
      "pattern": "^[0-9A-F]{64}(?![\\s\\S])"
    },
    "dataset_sha256": {
      "type": "string",
      "pattern": "^[0-9A-F]{64}(?![\\s\\S])"
    },
    "catalog_chapter": {
      "type": "string",
      "minLength": 1,
      "pattern": "\\S"
    },
    "catalog_pdf_pages": {
      "type": "object",
      "properties": {
        "first": {
          "type": "integer",
          "minimum": 1
        },
        "last": {
          "type": "integer",
          "minimum": 1
        }
      },
      "required": [
        "first",
        "last"
      ],
      "additionalProperties": false
    },
    "catalog_printed_pages": {
      "type": "object",
      "properties": {
        "first": {
          "type": "integer",
          "minimum": 1
        },
        "last": {
          "type": "integer",
          "minimum": 1
        }
      },
      "required": [
        "first",
        "last"
      ],
      "additionalProperties": false
    }
  },
  "required": [
    "title",
    "authority",
    "resolution",
    "resolution_date",
    "publication_date",
    "mandatory_effective_date",
    "resolution_url",
    "source_filename",
    "source_sha256",
    "dataset_sha256",
    "catalog_chapter",
    "catalog_pdf_pages",
    "catalog_printed_pages"
  ],
  "additionalProperties": false
}
